author,title,content,published_at,name
Reuters,Indonesia reports record COVID-19 deaths of more than 1000 - Reuters,"People wearing protective face masks stand in line while waiting to receive their dose of the vaccine against the coronavirus disease (COVID-19), during the mass vaccination program at Benoa Harbor, … [+624 chars]",2021-07-07T09:19:00Z,Reuters
FrontPageAfrica,Latest Covid-19 Surge in Liberia Mind-Boggling,Thousands die daily in India and over 650 deaths recorded just today alone in Russia from the Coronavirus. Liberia ranks number one in West Africa and the numbers could rise further. In just less tha… [+3627 chars],2021-07-07T09:18:49Z,AllAfrica - Top Africa News
FrontPageAfrica,Building Partnerships for Restoring Ecosystems in Liberia--Our Survival and Prosperity Depend On Nature,"On World Environment Day (5 June), the UN Secretary-General launched the UN Decade of Ecosystem Restoration (2021-2030) to prevent and halt further destruction of nature. This decade challenges gover… [+7639 chars]",2021-07-07T09:18:44Z,AllAfrica - Top Africa News
The New York Times,Studies Show Vaccines Are Effective Against Delta Variant,"LiveUpdated July 7, 2021, 5:02 a.m. ET
July 7, 2021, 5:02 a.m. ET
Israel reported that the Pfizer vaccine was 64 percent effective against the Delta variant, even as other studies suggest a higher … [+10203 chars]",2021-07-07T09:17:59Z,New York Times
ANI,"Cabinet reshuffle: 43 ministers, new and old, to take oath, says report","As many as 43 new members are all set to be sworn in this evening in Prime Minister Modi's new cabinet which will be one of the most inclusive with record representation of SC, ST members.
It is lea… [+2831 chars]",2021-07-07T09:17:38Z,Business Standard
Fortune Business Insights,Pipeline & Process Services Market Worth USD 4.90 Billion at 5.4% by 2028 Backed by Presence of a Large Number of Oil & Gas Fields in North America,"List of the Companies Profiled in the Market: Baker Hughes, Atlus Intervention, CR Asia Group, Eunisell Limited, Alphaden Energy &amp; Oilfield Limited,Cypress Pipeline &amp; Process Services, Hallib… [+12413 chars]",2021-07-07T09:17:00Z,Yahoo Entertainment
Joyce Ferriabough Bolling,Ferriabough Bolling: Communities suffer when mental health resources scarce,"When it comes to the issue of mental health, the cause getting the most attention right now is the Free Britney movement, which calls for an end to Spears’ conservatorship directed by her father, Jam… [+2931 chars]",2021-07-07T09:16:57Z,Boston Herald
agdigital,MIspa CountX & Mispa Viva,AGAP PE YOUR BEST PARTNER IN DIAGNOSTICS COMBO OFFER WARRANTY 3 YEAR WARRANTY Low MINIMIZE YOUR MAINTENANCE EXPENSES mISPAceunt)x AVIV MISP AVIVA MISPAccuntX Automated 3 Part Hematology Analyzer Semi… [+214 chars],2021-07-07T09:16:44Z,Visual.ly
