author,title,content,published_at,name
Colm Quinn,Saudi Arabia’s Hushed Washington Visit,"Here is todays Foreign Policy brief: Prince Khalid bin Salman continues Washington visit, the United Nations calls for talks on Ethiopian dam dispute, and Iran takes steps to produce enriched uranium… [+6709 chars]",2021-07-07T09:53:28Z,Foreign Policy
soyacincau,1 Utama: WhatsApp message claiming over 50 people infected with Delta variant is fake news,"The management of 1 Utama Shopping Centre today denied that any of its personnel or patrons have become infected with the highly contagious new strain of COVID-19 known identified as Delta.
In a Fac… [+814 chars]",2021-07-07T09:51:45Z,SoyaCincau.com
Papa Kuranchie,Covid 19: Kilkeel seafood factory closes due to outbreak,"Kilkeel Seafoods in County Down has temporarily shut down as a result of a Coronavirus outbreak.
The factory closed last Thursday following 42 confirmed positive cases. The tests were taken as a pre… [+614 chars]",2021-07-07T09:51:39Z,City A.M.
Mia Jankowicz,"Trump wanted to use the COVID-19 pandemic to call off the 2020 election, Wolff book says","Former President Donald Trump suggested using the COVID-19 pandemic as an excuse to not hold the 2020 presidential election, according to a new book. 
An excerpt from Michael Wolff's book ""Landslide… [+2394 chars]",2021-07-07T09:51:24Z,Business Insider
PTI,"Fitch cuts India growth forecast to 10%, says rapid vaccination to support revival","Fitch Ratings on Wednesday cut India's growth forecast to 10 per cent for the current fiscal, from 12.8 per cent estimated earlier, due to slowing recovery post second wave of COVID-19, and said rapi… [+3913 chars]",2021-07-07T09:50:36Z,Business Today
August Graham,UK lags behind global recovery for recruiting giants,"Two of the UKs biggest recruitment companies show that while the UK sector is recovering, it still has some way to go, despite bounces abroad.
Page Group said that its UK gross profit was still 9% b… [+1955 chars]",2021-07-07T09:49:43Z,Independent
Stephen Bush,Why millions will be self-isolating this summer,"As goes the England cricket team, so goes the country? Englands selectors have been forced to choose a brand new squad to face Pakistan after three players and four members of the coaching staff test… [+1532 chars]",2021-07-07T09:49:00Z,New Statesman
Nation,Kenya: Kenya Risks Losing U.S.$445 Million From Global Fund Over Graft,"The Global Fund says Kenya risks losing Sh48 billion if corruption allegations at the Kenya Medical Supplies Authority (Kemsa) are not completed and changes made to ensure transparency.
The Fund mob… [+3384 chars]",2021-07-07T09:45:57Z,AllAfrica - Top Africa News
Associated Press,Chinese authorities lock down border town as Myanmar battles outbreak,"Chinese authorities locked down a city bordering Myanmar on Wednesday, shutting most businesses and requiring residents to stay at home as a fresh outbreak of COVID-19 expanded.
Another 15 cases wer… [+2790 chars]",2021-07-07T09:45:32Z,Fox News
Mary Lewis,The Art of the Meal,"The authors honey-roasted salmon. (Becky Rinehart)
M
artinsburg, W
est V
irginiaLaughter, good conversation, and by all means good food nourish the soul. I learned everything about that, along wi… [+7148 chars]",2021-07-07T09:45:19Z,Thenation.com
Papa Kuranchie,Australia's Sydney Airport receives $16.7bn takeover offer,"A consortium of IFM investors, pension fund QSuper and Global Infrastructure Management has made an offer of AU$22.26b (£12.1b) for Sydney Airport. 
However, the AU$8.25 per share offer sits below t… [+824 chars]",2021-07-07T09:45:15Z,City A.M.
Economy Class & Beyond,"Heathrow Airport, with British Airways and Virgin Atlantic to launch “Proof of Vacination” trials","British Airways, Virgin Atlantic and Heathrow Airport have joined forces on a trial to prove its possible to quickly and easily verify those arriving into the UK who are fully vaccinated.
The new UK… [+5380 chars]",2021-07-07T09:44:55Z,Boardingarea.com
Silvia Amaro,EU hikes its growth forecasts for the euro area but warns on the delta variant spread,"LONDON The economic outlook has improved for the euro zone, according to the European Commission's latest forecasts on Wednesday, but the institution warned that the delta variant is a ""stark reminde… [+2458 chars]",2021-07-07T09:44:54Z,CNBC
James Tapsfield,Minister warns 'no guarantees' huge Wembley crowds won't spark Covid outbreak,"Ministers today warned there are 'no guarantees' that huge Wembley crowds will not spark outbreaks amid claims of Cabinet anxiety over the risks.
Business Secretary Kwasi Kwarteng insisted the poten… [+2596 chars]",2021-07-07T09:43:42Z,Daily Mail
Al Jazeera,COVID: Rumours make vaccinating Kashmir nomads difficult,Young health worker Masrat Farid has trekked long distances through remote Himalayan meadows in Indian-administered Kashmir to vaccinate nomadic herders in a campaign launched in June. Her challenge … [+2158 chars],2021-07-07T09:43:27Z,Al Jazeera English
Paul Skeldon,Challenger retail food and grocery delivery apps outperforming traditional supermarket retailers in customer experience,A European study of mobile app reviews shows that industry challengers in the UK retail food and grocery sector are receiving better reviews than traditional supermarket retailers – with such apps ou… [+3331 chars],2021-07-07T09:42:00Z,InternetRetailing
"The Saxon Hotel, Villas and Spa",The Saxon Hotel Installs Tech Savvy Upgrades,"The Saxon Hotel, Villas and Spa is proud to share the brand-new technology introduced at the hotel to improve the guests experience: a bespoke mobile phone app for a contactless and touchless Saxon e… [+7108 chars]",2021-07-07T09:40:24Z,Hospitality Net
sjones@insider.com (Stephen Jones),The Bank of England anticipates staff will return to the office at least 1 day a week from September,"The Bank of England has shed light on its hybrid working plans. 
The British central bank says that come September 2021 it will expect the majority of its 4,000 employees to return to the office at … [+1767 chars]",2021-07-07T09:40:14Z,Business Insider
https://www.facebook.com/bbcnews,Covid: Universal credit £20 top up set to be phased out,"The £20-a-week increase to universal credit will be ""phased out"" in the autumn, the government has confirmed.
Work and Pensions Secretary Therese Coffey told MPs the boost - introduced in April last… [+1531 chars]",2021-07-07T09:40:09Z,BBC News
"Alexandra Lukash, Nir Cohen",Culture minister says Israel not at point of reimposing virus restrictions,"Culture and Sports Minister Hili Tropper said Wednesday he doesn't believe Israel has reached a point where it needs to reimpose coronavirus restrictions. 
Israel has on Wednesday recorded over 500 … [+1589 chars]",2021-07-07T09:39:48Z,Ynetnews
https://www.facebook.com/bbcnews,Covid antibodies estimated for 91.8% of adults in Wales,"image copyrightGetty Images
image captionThe pace of the vaccine programme in Wales sees the modelled estimate for antibodies ahead of other UK nations and regions
Nearly 92% of adults in Wales now… [+1764 chars]",2021-07-07T09:39:01Z,BBC News
PTI,Indian IT industry to post strong recovery with 11% revenue growth in FY22: Crisil,"The Indian IT industry will stage a ""strong recovery"" in 2021-22 with a revenue growth of up to 11%, ratings agency said on Wednesday. The recovery will be led by increasing outsourcing and accelerat… [+2989 chars]",2021-07-07T09:38:43Z,The Times of India
Research and Markets,"Global Vaccine Delivery Devices Market (2021 to 2026) - by Device, Route of Administration, End-user and Region","Dublin, July 07, 2021 (GLOBE NEWSWIRE) -- The ""Global Vaccine Delivery Devices Market 2021-2026"" report has been added to ResearchAndMarkets.com's offering.
The global market for vaccine delivery de… [+8688 chars]",2021-07-07T09:38:00Z,Yahoo Entertainment
Amy Caren Daniel,Daily Update: Latest on the worldwide spread of the coronavirus,"The primie minister of Australia's New South Wales state today ordered a week-long extension of Sydney's Covid-19 lockdown, warning new cases are bound to rise as the country's biggest city grapples … [+3088 chars]",2021-07-07T09:37:05Z,Independent.ie
Staff Reporter,Anxious wait for Springboks who will be hoping Covid-19 doesn’t derail second Test against Georgia,"There have been four positive results in the Georgian team and four additional positive tests among Bok players - Marvin Orie, Frans Steyn, Handre Pollard and Frans Malherbe with an additional six po… [+1261 chars]",2021-07-07T09:36:55Z,IOL
Fortune Business Insights,"Cooling Towers Market to Hit USD 5.03 Billion by 2028; High Demand for Sustainable Products from Consumers to Bolster Growth Worldwide, says Fortune Business Insights™","List of the Companies Profiled in the Market: Krones AG, SPX CORPORATION, Babcock &amp; Wilcox Enterprises, EWK, Kelvion Holding GmbH, HAMON &amp; CIE (INTERNATIONAL) S.A.,MITA Cooling Technologies S… [+12300 chars]",2021-07-07T09:36:00Z,Yahoo Entertainment
Vuyolwethu Fundam,9 countries that offer digital nomad visas,"During the pandemic, the tourism sector has borne the brunt of the lockdown restrictions, resulting in an economic crisis for many countries.
As such, several governments are now focusing on attract… [+1439 chars]",2021-07-07T09:35:33Z,IOL
CNA,"China should guide rates lower to support growth, former central bank official says","BEIJING: China should guide market interest rates lower to support economic growth and ease funding pressure on local governments, a former central bank official said, adding to the debate over wheth… [+2968 chars]",2021-07-07T09:35:25Z,CNA
PR Newswire,"Commercial Vehicles Market Size To Reach $1.82 Trillion By 2028 | CAGR: 5.2%: Grand View Research, Inc.","SAN FRANCISCO, July 7, 2021 /PRNewswire/ -- The global commercial vehicles market size is expected to reach USD 1.82 trillion by 2028, according to a new report by Grand View Research, Inc. The marke… [+7961 chars]",2021-07-07T09:35:00Z,Yahoo Entertainment
Reuters,IWG grows to meet Covid-19- driven shift from big offices,"Britain's IWG has added more than 100 shared-office spaces to its global network this year, three times as many as in the first half of 2020, as it anticipates a lasting shift from working in large o… [+1674 chars]",2021-07-07T09:34:50Z,IOL
PTI,"Fitch cuts India growth forecast to 10%, says rapid vaccination to support revival","Fitch Ratings on Wednesday cut India's growth forecast to 10 per cent for the current fiscal, from 12.8 per cent estimated earlier, due to slowing recovery post second wave of COVID-19, and said rapi… [+3936 chars]",2021-07-07T09:34:26Z,The Times of India
mirrornews@mirror.co.uk (Dan Bloom),Millions of Brits a week face self-isolating by August 16 as Covid cases soar,"Millions of Brits a week face being forced into self-isolation before August 16 as ministers brace for an explosion in cases.
The number of people in England 'pinged' by the NHS Covid-19 app - told … [+3070 chars]",2021-07-07T09:34:22Z,Mirror Online
RT,China brings back lockdown in city bordering Myanmar amid fourth wave of Covid-19 infections,"Officials in Ruili, a city of 270,000 in China’s southwestern Yunnan province, imposed travel restrictions and asked all residents to self-isolate at home, Chinese media reported.
All businesses wer… [+1697 chars]",2021-07-07T09:33:02Z,RT
Trevor Filseth,Child Tax Credit 101: Things Every Parent Should Know,"Key Point: Next month, on July 15, 36 million households will receive their first of six monthly payments for the Child Tax Credit. For the most part, eligible families will have already received a l… [+3018 chars]",2021-07-07T09:33:00Z,The National Interest 
Paul Skeldon,Smart and soft PoS devices set for rapid and sustained growth as payment and shopping habits shift,"Smart PoS terminals globally in service, which integrate analytics and loyalty directly to the terminal, are set for extraordinary growth in the next five years driven by a range of drivers from risi… [+1878 chars]",2021-07-07T09:33:00Z,InternetRetailing
Reuters,"World stocks dip from record peak, dollar firm ahead of Fed minutes",World stocks dipped on Wednesday from recent record highs and the dollar edged towards three-month peaks as investors awaited minutes from the Federal Reserve's latest meeting to see if they confirm … [+4431 chars],2021-07-07T09:32:00Z,Business Standard
IANS,'Fully vaccinated people in UK won't have to self-isolate from Aug 16',The UK's Health Secretary Sajid Javid said that people who are fully vaccinated against Covid-19 will not have to self-isolate if they are in close contact with an infected person starting from Augus… [+2103 chars],2021-07-07T09:32:00Z,Business Standard
CNA,"Japan considers ban on all Olympic spectators, weighs extending COVID-19 curbs","TOKYO: Japan is considering banning all spectators from the Olympic Games, several sources told Reuters on Wednesday (Jul 7), as officials weigh extending novel coronavirus restrictions to contain in… [+4211 chars]",2021-07-07T09:31:46Z,CNA
"David Badash, The New Civil Rights Movement",Marjorie Taylor Greene again uses Holocaust and Nazi references in paranoid anti-vaxx attack on Joe Biden,"It was just three weeks ago that U.S. Rep. Marjorie Taylor Greene apologized to the nation for her Holocaust references, claiming after visiting the Holocaust Museum, I have made a mistake...the Holo… [+2437 chars]",2021-07-07T09:31:00Z,Raw Story
Reuters,German COVID-19 cases rise again after two months of decline - Reuters,"Residents queue at a sports hall to get vaccinated against the coronavirus disease (COVID-19) in Berlin, Germany, May 14, 2021. REUTERS/Axel SchmidtBERLIN, July 7 (Reuters) - The number of coronaviru… [+1597 chars]",2021-07-07T09:31:00Z,Reuters
The Irish Times,US piles pressure on EU to drop digital tax plan,"The US is piling pressure on the EU to shelve its plans for a levy on digital companies, arguing it could clash with Brussels pledge to avoid new punitive corporate taxes while negotiations on a land… [+3424 chars]",2021-07-07T09:30:53Z,The Irish Times
Citizen,Editorial - Adopt SADC Protocol On Tourism to Spur Growth,"Tourism is a major sector of Tanzania's economy, and can have a considerable impact on the country - be it an adverse or positive impact. For example, tourism revenues were $2.51 billion in 2019 - up… [+3236 chars]",2021-07-07T09:30:23Z,AllAfrica - Top Africa News
Citizen,Ethiopian Diplomat - PM Abiy Ahmed 'Misquoted' On Kenya Embassy Closure,"The Ethiopian ambassador to Kenya now says Prime Minister Abiy Ahmed was being hypothetical when he said the embassy in Kenya was among those to be shut down to save costs.
Meles Alem Tekea said the… [+7022 chars]",2021-07-07T09:30:23Z,AllAfrica - Top Africa News
Cassie,"You Ask, I Answer | The Business of Blogging","Hey guys… happy Hump Day! Assuming it’s Wednesday, these short weeks always throw me off. It doesn’t help that I’m sleeping in a different bed every night.
Wait, that sounded weird, ha! What I mean … [+14798 chars]",2021-07-07T09:30:21Z,Hisugarplum.com
Dr. Kavita Patel,5 things to know about the delta variant spreading around the U.S.,"Of the four significant variants of Covid-19 that we've identified so far, the delta variant is the one that should worry Americans but not for the reasons you would expect.
The mere existence of th… [+6872 chars]",2021-07-07T09:30:20Z,MSNBC
Stan Cole,What does technology mean for the post-Covid-19 banking sector?,Long gone are the days where it was necessary to enter a physical bank in order to handle and manage money. Recent technology has opened up a whole new world of opportunities in both retail and consu… [+7046 chars],2021-07-07T09:30:06Z,ITProPortal
Mark Magnier,"US needs to step up its game in Southeast Asia, says senior official","The US has been ""missing in action"" in Asia and needs to step up its game especially in Southeast Asia to show Chinese hardliners that the world's largest economic and military power is not in free f… [+6377 chars]",2021-07-07T09:30:00Z,Yahoo Entertainment
ACCESSWIRE,Kingfisher Begins Diamond Drilling at the Goldrange Project to Test the Cloud Drifter Trend,"VANCOUVER, BC / ACCESSWIRE / July 7, 2021 / Kingfisher Metals Corp. (TSX-V:KFR)(FSE:970) (""Kingfisher"" or the ""Company"") is pleased to announce the commencement of drilling at the Goldrange Project, … [+9091 chars]",2021-07-07T09:30:00Z,Yahoo Entertainment
Eric Ng eric.mpng@scmp.com,"Taiwan-listed companies outshine Hong Kong, mainland China peers on ESG disclosures, MioTech data shows","When it comes to disclosing what they are doing to help the environment and society at large, Taiwan-listed companies are outshining their peers in Hong Kong and mainland China, according to data pro… [+4978 chars]",2021-07-07T09:30:00Z,Yahoo Entertainment
PR Newswire,Baby Oral Care Market: Forecast of Healthy Y-o-Y Growth Rate at 1.71%,"COVID-19 Analysis, Drivers, Restraints, Opportunities, and Threats | Evolving Opportunities with Amway Corp. and Church and Dwight Co. Inc. - Technavio
NEW YORK, July 7, 2021 /PRNewswire/ --
Techna… [+6201 chars]",2021-07-07T09:30:00Z,Yahoo Entertainment
Elliot Smith,"Covid cases surge while vaccines stagnate in Africa, as experts urge greater global contribution","Health workers chat near an ambulance at the parking lot of the Steve Biko Academic Hospital, amid a nationwide coronavirus disease (COVID-19) lockdown, in Pretoria, South Africa, January 11, 2021.
… [+5643 chars]",2021-07-07T09:29:18Z,CNBC
Reuters,Oil rises to $75 after tumble but OPEC+ uncertainty clouds outlook,"Oil rose to $75 a barrel on Wednesday with support coming from a tight market, after a steep drop from multi-year highs in the previous session amid uncertainty about OPEC+ supply policy.
A failure … [+3126 chars]",2021-07-07T09:28:00Z,Business Standard
"Angelina Villa-Clarke, Contributor, 
 Angelina Villa-Clarke, Contributor
 https://www.forbes.com/sites/angelinavillaclarke/",The Henrietta Collaborates With Italian Supper Club To Offer A Slice Of Southern Italy In The Heart Of Covent Garden,"Its a quirky little place, on a charming little street smack bang in the heart of Covent Garden. Blink and youll miss it perhaps, but that is partly what makes The Henrietta Hotel one of Londons fine… [+5129 chars]",2021-07-07T09:27:06Z,Forbes
ALEXANDRA JAFFE,"In Illinois, Biden to push money for families and child care","WASHINGTON (AP) President Joe Biden is turning his focus to pitching his proposed investments in families and education, using a visit to a community college in a key Illinois swing district to highl… [+3078 chars]",2021-07-07T09:26:09Z,The Boston Globe
Press Trust of India,Odisha reports its highest single-day Covid deaths as 59 lose lives,"Odisha on Wednesday reported the highest single-day COVID-19 fatality as 59 people died, taking the toll to 4,358, a Health Department official said.
The state also registered 2,602 new cases, pushi… [+2970 chars]",2021-07-07T09:26:00Z,Business Standard
Arutz Sheva Staff,Watch: Woman arrested for trying to extinguish Olympic flame in opposition to the venue,Video: South China Morning Post,2021-07-07T09:25:34Z,Israelnationalnews.com
Arutz Sheva Staff,"521 new COVID cases, infection rate stabilizes","A total of 521 new cases of the coronavirus were reported across Israel Tuesday, according to data released by the Health Ministry Wednesday morning. That is up from 501 new cases reported a day earl… [+1080 chars]",2021-07-07T09:25:34Z,Israelnationalnews.com
The Associated Press,"EU upbeat over economic growth, concerned about inflation","BRUSSELS -- European Union economies are set to rebound by their highest rates in decades as coronavirus restrictions ease, but still face risks posed by COVID-19 variants and concerns over inflation… [+1742 chars]",2021-07-07T09:24:45Z,ABC News
Press Trust of India,"Fitch cuts India growth forecast to 10%, says vaccination to help revival","Fitch Ratings on Wednesday cut India's growth forecast to 10 per cent for the current fiscal, from 12.8 per cent estimated earlier, due to slowing recovery post second wave of COVID-19, and said rapi… [+5319 chars]",2021-07-07T09:24:00Z,Business Standard
Research and Markets,"Global Food Safety Testing Market Report 2021: Market will Surpass $19.36 Billion by the End of 2027, from $12.09 Billion in 2020","Dublin, July 07, 2021 (GLOBE NEWSWIRE) -- The ""Food Safety Testing Market, Global Forecast, Impact of COVID-19, Industry Trends, Growth, Opportunity Company Overview, Sales Analysis"" report has been … [+5610 chars]",2021-07-07T09:23:00Z,Yahoo Entertainment
SI Reporter,Natco Pharma slips 6% as Delhi HC allows injunction application by FMC Corp,"Shares of Natco Pharma slipped 6 per cent to Rs 1,092.35 on the BSE in intra-day trade on Wednesday after the Delhi High Court allowed the application by FMC Corporation on Chlorantraniliprole (CTPR)… [+2985 chars]",2021-07-07T09:23:00Z,Business Standard
Agnee Ghosh,India’s all-women frontline defence against COVID-19 fight for fair pay,"Because ASHAs are paid on an incentive basis, their incomes fluctuate from month to month. Although their basic monthly salaries are paid on time, ASHA workers often wont see any money from the incen… [+3227 chars]",2021-07-07T09:22:50Z,Open Democracy
ReportLinker,"The global piezoelectric devices market is projected to reach USD 35.4 billion by 2026 from an estimated USD 28.7 billion in 2021, at a CAGR of 4.3% from 2021 to 2026",The rising demand for piezoelectric devices for energy harvesting is among the factors driving the growth of the piezoelectric devices market. The piezoelectric actuators segment held the major share… [+5552 chars],2021-07-07T09:22:00Z,Yahoo Entertainment
Stephanie Linning,"Couple quit corporate life to travel the UK in renovated £4,500 campervan","A couple who quit city life to travel the UK in a renovated minibus have revealed how they cut their outgoings from over £3,500 to around £250 a month.
Graphic designers Charlie Osman, 28, and Josh … [+10400 chars]",2021-07-07T09:21:59Z,Daily Mail
WY Capital,iSpecimen: High Growth Marketplace At A Discount,"anyaivanova/iStock via Getty Images
At first glance, iSpecimen (ISPC) seems like another failed IPO. After pricing its IPO at $8, iSpecimen has performed extremely poorly, dropping over 20% within 2… [+7672 chars]",2021-07-07T09:21:45Z,Seeking Alpha
BOOX Research,Spirit Airlines: Buying The Dip As Air Travel Recovers,"DaveAlan/iStock Unreleased via Getty Images
Spirit Airlines Inc. (NYSE:SAVE) calls itself an ""ultra-low-cost carrier"" positioning itself as an affordable and convenient no-frills travel option with … [+9079 chars]",2021-07-07T09:21:27Z,Seeking Alpha
Cooper Inveen,Belgian-Congolese chef opens Senegal's first artisan chocolate shop - Reuters,"DAKAR, July 7 (Reuters) - Forced by the COVID-19 pandemic to abandon plans to open a restaurant, Danuta Nganko, a Belgian-Congolese chef in Senegal's capital Dakar, settled instead on an even tastier… [+1763 chars]",2021-07-07T09:21:00Z,Reuters
John Steenhuisen,News24.com | John Steenhuisen | Nkandla policing: There is no social compact if the rules only apply to some,"It is imperative that president Cyril Ramaphosa come out of hiding and tell the nation what exactly this social compact of his still means, writes Democratic Alliance (DA) leader writes John Steenhui… [+9035 chars]",2021-07-07T09:20:44Z,News24
CNA,Indonesia expands nationwide COVID-19 curbs,"JAKARTA: Indonesia expanded nationwide coronavirus curbs Wednesday (Jul 7) to battle its deadliest COVID-19 wave yet, as the death toll rocketed with the government warning that the worst may be yet … [+3113 chars]",2021-07-07T09:20:04Z,CNA
Press Trust of India,"Delta dominant variant in US, makes up more than half of Covid cases: CDC","The highly contagious Delta variant has become the dominant coronavirus strain in the US, accounting for more than 51 per cent of Covid infections in the country, according to new data released by th… [+6541 chars]",2021-07-07T09:20:00Z,Business Standard
nypost.com,"Unvaccinated people entering ‘death lottery,’ West Virginia Gov. Jim Justice warns","Skip to comments.
Unvaccinated people entering death lottery, West Virginia Gov. Jim Justice warnsnypost.com ^
 | July 6, 2021 
 | Alexandria Hein , Fox News
Posted on 07/07/2021 2:19:05 AM PDT b… [+1623 chars]",2021-07-07T09:19:05Z,Freerepublic.com
PR Newswire,"ADAMA Releases First Annual Environmental, Social, and Governance (ESG) Report","TEL AVIV, Israel, July 7, 2021 /PRNewswire/ -- ADAMA Ltd. (SZSE 000553), a leading global crop protection company, released its first annual ESG report today, in conjunction with its 2020 sustainabil… [+4860 chars]",2021-07-07T09:19:00Z,Yahoo Entertainment
Press Trust of India,IT industry to post strong recovery with 11% revenue growth in FY22: Crisil,"The Indian IT industry will stage a strong recovery in 2021-22 with a revenue growth of up to 11 per cent, ratings agency Crisil said on Wednesday.
The recovery will be led by increasing outsourcing… [+3304 chars]",2021-07-07T09:19:00Z,Business Standard
Sanjeeb Mukherjee,"One-Nation-One-Ration-Card suffers from exclusion issues, say experts",Business Standard has always strived hard to provide up-to-date information and commentary on developments that are of interest to you and have wider political and economic implications for the count… [+1029 chars],2021-07-07T09:19:00Z,Business Standard
